job_id,job_title,company,location,summary,job_link,company_link,desired_experience,contacts_fetched?
p_63d9efa0265607e0,Supply Chain Analyst/Buyer,ZeroCater,"South San Francisco, CA","With our $12M in Series B funding and ability to now distribute alcohol, we plan to expand Snacks and Catering nationally to new enterprise and Fortune 500...",https://www.indeed.com/rc/clk?jk=63d9efa0265607e0&fccid=486920f4f8b69ec1&vjs=3,https://www.indeed.com/cmp/Zerocater,,No
p_6ff4007deb423e32,Software Engineer - Distributed Systems,Jobspring Partners,"Redwood City, CA","Are you a talented backend engineer looking to join a local Series B company? If you are a hard-working, driven, and creative software engineer, apply now!...",https://www.indeed.com/rc/clk?jk=6ff4007deb423e32&fccid=4a2d2fbadf14d480&vjs=3,https://www.indeed.com/cmp/Jobspring-Partners,"Java, Linux",No
p_eb3326a6fcd4e115,Senior Product Manager,ZeroCater,"San Francisco, CA",We are seeking a Senior Product Manager to own a major line of business that touches thousands of companies. You must have worked extensively with engineering...,https://www.indeed.com/rc/clk?jk=eb3326a6fcd4e115&fccid=486920f4f8b69ec1&vjs=3,https://www.indeed.com/cmp/Zerocater,,No
p_2caddea087a964a5,People Operations Manager,ZeroCater,"San Francisco, CA","With our $12M in Series B funding and ability to now distribute alcohol, we plan to expand Snacks and Catering nationally to new enterprise and Fortune 500...",https://www.indeed.com/rc/clk?jk=2caddea087a964a5&fccid=486920f4f8b69ec1&vjs=3,https://www.indeed.com/cmp/Zerocater,,No
p_115766aea06aee39,Principal QA Engineer,OpenGov,"San Francisco, CA","$80 million, Series C company, from top tier investors including Andreessen Horowitz, 8VC, Thrive Capital, and Emerson Collective....",https://www.indeed.com/rc/clk?jk=115766aea06aee39&fccid=cc344bb690cc0dd4&vjs=3,https://www.indeed.com/cmp/Opengov,"C, Agile, AWS, REST, QA, UI, SQL, cloud",No
p_6d2ee4fe1ed151a4,Mid-level Python Developer,Workbridge Associates,"San Francisco, CA",A pre-Series B startup in San Francisco is looking for a Senior Python engineer for their SoMA Headquarters. This person would be working on building the first...,https://www.indeed.com/rc/clk?jk=6d2ee4fe1ed151a4&fccid=a6920e0a635e5c4e&vjs=3,https://www.indeed.com/cmp/Workbridge-Associates,"Flask, Python, PostgreSQL, RabbitMQ, Django, Elastic Search",No
p_295b24b47afe88a8,Salesforce Business Analyst,ZeroCater,"San Francisco, CA","SFDC Certification a plus (Admin, App Builder, Developer, etc). With our $12M in Series B funding and ability to now distribute alcohol, we plan to expand...",https://www.indeed.com/rc/clk?jk=295b24b47afe88a8&fccid=486920f4f8b69ec1&vjs=3,https://www.indeed.com/cmp/Zerocater,Salesforce,No
p_2906e84fd662009a,Senior Software Engineer (Python),Jobspring Partners,"San Francisco, CA",A startup that has reached their Series C funding is looking for a Senior Software Engineer to help lead their team....,https://www.indeed.com/rc/clk?jk=2906e84fd662009a&fccid=4a2d2fbadf14d480&vjs=3,https://www.indeed.com/cmp/Jobspring-Partners,"Flask, Python, C, Vue.js, Django",No
p_f02bbea1b44c48ae,Senior Python Engineer,Jobspring Partners,"San Francisco, CA",Degree in Computer Science or related field. Startup experience and a Computer Science background are both highly desirable as well....,https://www.indeed.com/rc/clk?jk=f02bbea1b44c48ae&fccid=4a2d2fbadf14d480&vjs=3,https://www.indeed.com/cmp/Jobspring-Partners,"AI, React.js, Javascript",No
p_06ef7e396e4a953b,Front End Angular Engineer,Jobspring Partners,"Redwood City, CA","In Computer Science or related field. An early-stage pre-Series B drone start up is currently seeking a Front End engineer to join their small, energetic team....",https://www.indeed.com/rc/clk?jk=06ef7e396e4a953b&fccid=4a2d2fbadf14d480&vjs=3,https://www.indeed.com/cmp/Jobspring-Partners,"Python, UI, Angular, Django",No
p_0cfa7620628c0c00,Senior Software Engineer,OpenGov,"San Francisco, CA","$80 million, Series C company, from top tier investors including Andreessen Horowitz, 8VC, Thrive Capital, and Emerson Collective....",https://www.indeed.com/rc/clk?jk=0cfa7620628c0c00&fccid=cc344bb690cc0dd4&vjs=3,https://www.indeed.com/cmp/Opengov,"C, TypeScript, Java, NoSQL, Spring, MongoDB, SQL, Apache, Redux, cloud",No
p_be858b62d1112abd,Principal Software Engineer,OpenGov,"San Francisco, CA","$80 million, Series C company, from top tier investors including Andreessen Horowitz, 8VC, Thrive Capital, and Emerson Collective....",https://www.indeed.com/rc/clk?jk=be858b62d1112abd&fccid=cc344bb690cc0dd4&vjs=3,https://www.indeed.com/cmp/Opengov,"C, TypeScript, Java, NoSQL, Spring, MongoDB, SQL, Apache, Redux, cloud",No
